{
    "jurisdiction_id": "LUX",
    "name": "Luxembourg RAIF Law (AML/CFT)",
    "effective_date": "2025-01-01",
    "requirements": {
        "allowed_jurisdictions": [
            "LU",
            "EU",
            "US",
            "UK",
            "CH"
        ],
        "minimum_investment": 125000,
        "required_status": [
            "WELL_INFORMED_INVESTOR",
            "CSSF_EQUIVALENT"
        ],
        "vrf_probability": 0.01
    }
}